Category,Sub-Category,Micro-Category,Name,URL,Phone,Message,Email,Location,Social,Description,Other
State,Texas,Security,TxDPS,https://www.dps.texas.gov/,512-424-2000,Texas Department of Public Safety with significant border security operations,Via state procurement,TX,,High relevance for surveillance, monitoring, data fusion, AI for border security,
State,Texas,Emergency,TDEM,https://tdem.texas.gov/,512-424-2208,Texas Division of Emergency Management operating State Operations Center,Via Texas SmartBuy,TX,,Needs in situational awareness and communications for disasters and border events,
International,Finland,Defense,Finland MoD/FDF,https://www.defmin.fi/en/contact_information,N/A,Ministry of Defence and Finnish Defence Forces with border security focus,kirjaamo@defmin.fi,Finland,,Relevant for border surveillance technology with NATO DIANA participation,
International,Finland,Innovation,Business Finland,https://www.businessfinland.fi/en/,+358 29 50 55000,National agency promoting trade, investment, and innovation funding,Via website contacts,Finland,,Facilitates market entry, funding, and partnerships for foreign companies,
International,Finland,Research,VTT,https://www.vttresearch.com/en,+358 20 722 111,Technical Research Centre with capabilities in sensing, AI, connectivity, cybersecurity,info@vtt.fi,Finland,,Major R&D hub for advanced technologies with industry partnerships,
International,Estonia,Defense,Estonia RKIK,https://www.kaitseinvesteeringud.ee/en/,+372 717 0600,Estonian Centre for Defence Investment managing procurements,rkik@rkik.ee,Estonia,,Defense procurement agency with NATO DIANA participation,
International,Latvia,Defense,Latvia MoD/VALIC,https://www.mod.gov.lv/en/ministry/contacts,+371 6733 5113,Latvian defense ministry and procurement center,kanceleja@mod.gov.lv,Latvia,,Defense ministry investing in border surveillance capabilities,
International,Lithuania,Defense,Lithuania MoND/DMA,https://kam.lt/en/structure-and-contacts/defence-materiel-agency/,+370 5 278 5313,Lithuanian Defence Materiel Agency for procurement,viva@kam.lt,Lithuania,,Defense procurement agency focused on modernization,
International,Taiwan,Defense,Taiwan NCSIST,https://www.ncsist.org.tw/eng,+886-3-471-2201,National Chung-Shan Institute of Science and Technology for defense R&D,Via website contacts,Taiwan,,Primary defense R&D entity for missiles, radar, C4ISR, and cyber,
International,Taiwan,Research,ITRI,https://www.itri.org.tw/english/,+886-3-591-64874,Industrial Technology Research Institute with strong industry collaboration,service@itri.org.tw,Taiwan,,Major R&D hub in ICT, AI, sensors, and robotics with international partnerships,
International,Taiwan,Funding,Taiwan NSTC,https://www.nstc.gov.tw/nstc/main?lang=en,N/A,National Science and Technology Council funding research in AI and security,Via website contacts,Taiwan,,Funds research in AI, semiconductors, cybersecurity, and space technology, 
Government,Justice,Corrections,Federal Bureau of Prisons (BOP),https://www.bop.gov/business/,202-307-3198,Central office for federal prison procurement; Small business program available; Uses SAM.gov and Unison Marketplace,BOP-ADM-SmallBusinessProgram-S@bop.gov,,,Federal prison system procurement; Small business program available,General info: info@bop.gov 202-307-2712
State,New York,Corrections,New York State Department of Corrections and Community Supervision (DOCCS),https://doccs.ny.gov/procurement-opportunities,N/A,State corrections procurement; MWBE program for minority and women-owned businesses,N/A,NY,,New York state corrections procurement with MWBE program,
State,Texas,Corrections,Texas Department of Criminal Justice (TDCJ),https://www.tdcj.texas.gov/divisions/bfd/contracts_contracts_current_docs.html,N/A,Business and Finance Division handles contracts and procurement,N/A,Two Financial Plaza Suite 525 Huntsville TX 77340,,Texas corrections procurement through Business and Finance Division,
State,Florida,Corrections,Florida Department of Corrections (FDC),https://www.fdc.myflorida.com/business/index.html,N/A,State corrections procurement; Business opportunities listed on website,N/A,FL,,Florida corrections procurement and business opportunities,Also see: https://www.fdc.myflorida.com/purchasing-with-the-state-of-florida
State,California,Corrections,California Department of Corrections and Rehabilitation (CDCR),https://www.cdcr.ca.gov/obs/contact/,916-255-5624,Contracts and Procurement Help Desk; Small Business/DVBE advocacy available; Uses Cal eProcure state portal,SBDVBEAdvocate@CDCR.ca.gov,CA,,California corrections procurement with small business and disabled veteran business programs,Small Business/DVBE Advocate: 279-210-3704; Cal eProcure Support: 1-855-421-6355 